<?xml version="1.0" encoding="UTF-8" standalone="yes"?>
<!--
  ~  Licensed to the Apache Software Foundation (ASF) under one
  ~  or more contributor license agreements.  See the NOTICE file
  ~  distributed with this work for additional information
  ~  regarding copyright ownership.  The ASF licenses this file
  ~  to you under the Apache License, Version 2.0 (the
  ~  "License"); you may not use this file except in compliance
  ~  with the License.  You may obtain a copy of the License at
  ~
  ~        http://www.apache.org/licenses/LICENSE-2.0
  ~
  ~  Unless required by applicable law or agreed to in writing,
  ~  software distributed under the License is distributed on an
  ~  "AS IS" BASIS, WITHOUT WARRANTIES OR CONDITIONS OF ANY
  ~  KIND, either express or implied.  See the License for the
  ~  specific language governing permissions and limitations
  ~  under the License.
  ~
  -->

<bs:grid xsi:schemaLocation="http://isis.apache.org/applib/layout/component https://causeway.apache.org/applib/layout-v1/component/component.xsd http://isis.apache.org/applib/layout/grid/bootstrap3 https://causeway.apache.org/applib/layout-v1/grid/bootstrap3/bootstrap3.xsd" xmlns:c="http://isis.apache.org/applib/layout/component" xmlns:bs="http://isis.apache.org/applib/layout/grid/bootstrap3" xmlns:xsi="http://www.w3.org/2001/XMLSchema-instance">

    <bs:row>
        <bs:col span="12" unreferencedActions="true">
            <c:domainObject bookmarking="AS_ROOT"/>
        </bs:col>
    </bs:row>
    <bs:row>
        <bs:col span="6">
            <bs:row>
                <bs:col span="12">
                    <bs:tabGroup>
                        <bs:tab name="Identity">
                            <bs:row>
                                <bs:col span="12">
                                    <c:fieldSet name="Identity" id="identity"/>
                                </bs:col>
                            </bs:row>
                        </bs:tab>
                        <bs:tab name="Other">
                            <bs:row>
                                <bs:col span="12">
                                    <c:fieldSet name="Other" id="other" unreferencedProperties="true"/>
                                </bs:col>
                            </bs:row>
                        </bs:tab>
                        <bs:tab name="Metadata">
                            <bs:row>
                                <bs:col span="12">
                                    <c:fieldSet name="Metadata" id="metadata"/>
                                </bs:col>
                            </bs:row>
                        </bs:tab>
                    </bs:tabGroup>
                </bs:col>
                <bs:col span="12">
                    <c:fieldSet name="Details" id="details"/>
                </bs:col>
            </bs:row>
        </bs:col>
        <bs:col span="6">
            <bs:tabGroup  unreferencedCollections="true">
            </bs:tabGroup>
        </bs:col>
    </bs:row>
</bs:grid>
