<?xml version="1.0" encoding="UTF-8"?><bs:grid xmlns:bs="https://causeway.apache.org/applib/layout/grid/bootstrap3" xmlns:lnk="https://causeway.apache.org/applib/layout/links" xmlns:cpt="https://causeway.apache.org/applib/layout/component" xmlns:xsi="http://www.w3.org/2001/XMLSchema-instance" xsi:schemaLocation="https://causeway.apache.org/applib/layout/component https://causeway.apache.org/applib/layout/component/component.xsd https://causeway.apache.org/applib/layout/links https://causeway.apache.org/applib/layout/links/links.xsd https://causeway.apache.org/applib/layout/grid/bootstrap3 https://causeway.apache.org/applib/layout/grid/bootstrap3/bootstrap3.xsd">
    <bs:row>
        <bs:col span="8" unreferencedActions="true">
            <cpt:domainObject/>
        </bs:col>
        <bs:col span="4">
            <bs:tabGroup>
                <bs:tab name="Identity">
                    <bs:row>
                        <bs:col span="12">
                            <cpt:fieldSet name="Identity" id="identity"/>
                        </bs:col>
                    </bs:row>
                </bs:tab>
                <bs:tab name="Other">
                    <bs:row>
                        <bs:col span="12">
                            <cpt:fieldSet name="Other" id="other" unreferencedProperties="true"/>
                        </bs:col>
                    </bs:row>
                </bs:tab>
                <bs:tab name="Metadata">
                    <bs:row>
                        <bs:col span="12">
                            <cpt:fieldSet name="Metadata" id="metadata"/>
                        </bs:col>
                    </bs:row>
                </bs:tab>
            </bs:tabGroup>
        </bs:col>
    </bs:row>
    <bs:row>
        <bs:col span="12">
            <bs:row>
                <bs:col span="12" size="MD">
                    <cpt:collection defaultView="table" paged="15" id="notYetReplayed"/>
                </bs:col>
            </bs:row>
        </bs:col>
    </bs:row>
    <bs:row>
        <bs:col span="12">
            <bs:tabGroup unreferencedCollections="true">
            </bs:tabGroup>
        </bs:col>
    </bs:row>
</bs:grid>
